scenario_id,scenario_text,option_1,option_2,option_1_type,option_2_type
3,"Вы с нетерпением ждали вечеринку в честь Хэллоуина в этом году. У вас есть подходящая накидка, парик и шляпа. Всю неделю вы пытались усовершенствовать свой наряд, вырезая большое количество крошечных звездочек, чтобы приклеить их к накидке и шляпе, и вам еще предстоит их приклеить. В день Хэллоуина вы решаете, что костюм выглядит лучше без всех этих звездочек, над которыми вы так усердно трудились. Что вы сделаете?","Приклею звездочки","не буду приклеивать звездочки","sunk_cost","rational"
6,"Вас попросили произнести тост на свадьбе вашего друга. Вы часами работали над одной историей о том, как вы с другом учились в автошколе, но вам еще нужно немного доработать ее. Затем вы понимаете, что сможете закончить написание речи быстрее, если начнёте заново и расскажете более смешную историю о совместных занятиях танцами. Что вы сделаете?","Закончу тост про вождение","перепишу тост про танцы","sunk_cost","rational"
10,"Вы красите стены своей спальни в любимый цвет и рисуете узоры. На это уходит много времени. После того, как вы покрасили две из четырех стен, вы понимаете, что предпочли бы однотонный цвет вместо узоров . У вас осталось достаточно краски, чтобы перекрасить всю комнату в однотонный цвет. Это займет у вас столько же времени, сколько и завершение узора на двух оставшихся стенах. Что вы сделаете?","продолжу нанесение узоров","перекрашу комнату в однотонный цвет","sunk_cost","rational"
11,"Вы потратили много времени на проект, и он, кажется, проваливается. У вас есть возможность начать что-то другое, что, как вы теперь знаете, имеет больше шансов на успех, но вы не можете вернуть время, потраченное на проект. Что вы сделаете?","Продолжу заниматься проектом","начну что-то другое","sunk_cost","rational"
12,"Вы разрабатывали инвестиционную стратегию в течение нескольких месяцев. Она не работает, и вы теряете деньги, но у вас нет возможности вернуть потраченные усилия на разработку этой стратегии. Что вы сделаете?","Начну разработку новой стратегии","Продолжу в том же духе","rational","sunk_cost"
14,"Ваши отношения с партнёром складываются не очень хорошо. Вы много думали и поняли, что если бы вы знали, как всё сложится с самого начала, то не стали бы вступать в эти отношения. Теперь у вас есть возможность расстаться, но вы были вместе уже много месяцев. Что вы сделаете?","Продолжу отношения","Расстанусь","sunk_cost","rational"
15,"Вы долго думали о том, как проголосовать на выборах, и потратили много времени, чтобы попытаться принять правильное решение, включая чтение газет, комментариев в интернете и серьёзное обдумывание всех вопросов. Вы обнаруживаете, что большая часть информации, которую вы читали, была ложной, а более надёжный источник указывает на то, что ваше первоначальное мнение было неверным. Что вы сделаете?","Сохраню прежние убеждения","Изменю свои убеждения","sunk_cost","rational"
16,"Вы усердно думали о том, как лучше всего добраться до места, где вы никогда раньше не были. К сожалению, ваше интернет-соединение не работает, поэтому вам приходится принимать решение, основываясь на своих представлениях о планировке города. Вы приходите к выводу о наилучшем возможном маршруте, но внезапно интернет снова появляется. Что вы сделаете?","Посмотрите маршрут в телефоне","пойдете по запланированному маршруту","rational","sunk_cost"
